{"access":{"mode":"acl-only","visibility":"public"},"adapter":{"fingerprint":"eeec9b60a50126a874eadef47bd52b6f019870325e4d4e91ca7017594c2a81b6","id":"hive-hub.subscription/1"},"conformance":{"artifact_sha256":"5e14ecb0fce1763e82254394724987b8fe8978e1c594553512d699b4a5d718a5","id":"rapp-work-organization-seed/1"},"extensions":{"authority":false,"sdk_commit":"29ead23b21645f8d7682ee00414930ffa9ce0ca6","seed":{"bytes":194902,"sha256":"7ded7c42455053bf66ca77e8eb0a75257c1adfa103827174a4390a35442aef22","url":"https://kody-w.github.io/hive-hub/api/hive-hub/v1/source/organization-seeds/open-source-infrastructure-foundation.json"},"seed_status":"seed-not-activated","workspace_profile":"rapp-work-sdk/1"},"id":"dial:sha256:3dec7fe034b05bff626337f18981ce2d7c4ae1c7957992c6b13d40f53edc6bf1","join":{"kind":"subscription","next_step":"Inspect the The Open-Source Infrastructure Foundation seed's initialize.json, team work, and synthetic case. Use your locally trusted exact RAPP Work SDK to plan Organization and Workspace creation. Obtain approval of complete native plans and starter-file effects before setup. This subscription does not activate an organization, run downloaded code, or grant membership."},"learning":{"artifacts":[{"bytes":1698,"media_type":"application/json","role":"spec","sha256":"6f11e0a9a8165b35be877caf3651e0dbddc2b7cd7049407d3653ab6c036865a6","url":"https://kody-w.github.io/hive-hub/api/hive-hub/v1/source/protocols/rapp-work-organization-seed-v1.json"},{"bytes":1676,"media_type":"application/json","role":"conformance","sha256":"5e14ecb0fce1763e82254394724987b8fe8978e1c594553512d699b4a5d718a5","url":"https://kody-w.github.io/hive-hub/api/hive-hub/v1/source/conformance/rapp-work-organization-seed-v1.json"},{"bytes":194902,"media_type":"application/json","role":"examples","sha256":"7ded7c42455053bf66ca77e8eb0a75257c1adfa103827174a4390a35442aef22","url":"https://kody-w.github.io/hive-hub/api/hive-hub/v1/source/organization-seeds/open-source-infrastructure-foundation.json"}],"schema":"hive-hub-learning-bundle/1","sha256":"116a1964d3368e325f6febf516a0b27caa29a59c8266eb40e6f202dd5bd46d67"},"name":"The Open-Source Infrastructure Foundation","protocol":{"fingerprint":"6f11e0a9a8165b35be877caf3651e0dbddc2b7cd7049407d3653ab6c036865a6","id":"rapp-work-sdk/1","spec_sha256":"6f11e0a9a8165b35be877caf3651e0dbddc2b7cd7049407d3653ab6c036865a6"},"schema":"hive-hub-declaration/1"}
