{"access":{"mode":"acl-only","visibility":"public"},"adapter":{"fingerprint":"eeec9b60a50126a874eadef47bd52b6f019870325e4d4e91ca7017594c2a81b6","id":"hive-hub.subscription/1"},"conformance":{"artifact_sha256":"5e14ecb0fce1763e82254394724987b8fe8978e1c594553512d699b4a5d718a5","id":"rapp-work-organization-seed/1"},"extensions":{"authority":false,"sdk_commit":"29ead23b21645f8d7682ee00414930ffa9ce0ca6","seed":{"bytes":185389,"sha256":"5a22854eb76ddea1ebb6359aafc32233c7f20aef611c4551e752174cd9565ce9","url":"https://kody-w.github.io/hive-hub/api/hive-hub/v1/source/organization-seeds/public-source-intelligence-bureau.json"},"seed_status":"seed-not-activated","workspace_profile":"rapp-work-sdk/1"},"id":"dial:sha256:e373a907db64f9c48da04652cadc59fb7917c63be6c1ea63df6c9fcb9b456633","join":{"kind":"subscription","next_step":"Inspect the The Public-Source Intelligence Bureau seed's initialize.json, team work, and synthetic case. Use your locally trusted exact RAPP Work SDK to plan Organization and Workspace creation. Obtain approval of complete native plans and starter-file effects before setup. This subscription does not activate an organization, run downloaded code, or grant membership."},"learning":{"artifacts":[{"bytes":1698,"media_type":"application/json","role":"spec","sha256":"6f11e0a9a8165b35be877caf3651e0dbddc2b7cd7049407d3653ab6c036865a6","url":"https://kody-w.github.io/hive-hub/api/hive-hub/v1/source/protocols/rapp-work-organization-seed-v1.json"},{"bytes":1676,"media_type":"application/json","role":"conformance","sha256":"5e14ecb0fce1763e82254394724987b8fe8978e1c594553512d699b4a5d718a5","url":"https://kody-w.github.io/hive-hub/api/hive-hub/v1/source/conformance/rapp-work-organization-seed-v1.json"},{"bytes":185389,"media_type":"application/json","role":"examples","sha256":"5a22854eb76ddea1ebb6359aafc32233c7f20aef611c4551e752174cd9565ce9","url":"https://kody-w.github.io/hive-hub/api/hive-hub/v1/source/organization-seeds/public-source-intelligence-bureau.json"}],"schema":"hive-hub-learning-bundle/1","sha256":"15dd6d9e07157663e2b298c965980ed682b3d80c42c301cd0af9ac371a79ae46"},"name":"The Public-Source Intelligence Bureau","protocol":{"fingerprint":"6f11e0a9a8165b35be877caf3651e0dbddc2b7cd7049407d3653ab6c036865a6","id":"rapp-work-sdk/1","spec_sha256":"6f11e0a9a8165b35be877caf3651e0dbddc2b7cd7049407d3653ab6c036865a6"},"schema":"hive-hub-declaration/1"}
