{"access":{"mode":"acl-only","visibility":"public"},"adapter":{"fingerprint":"eeec9b60a50126a874eadef47bd52b6f019870325e4d4e91ca7017594c2a81b6","id":"hive-hub.subscription/1"},"conformance":{"artifact_sha256":"5e14ecb0fce1763e82254394724987b8fe8978e1c594553512d699b4a5d718a5","id":"rapp-work-organization-seed/1"},"extensions":{"authority":false,"sdk_commit":"29ead23b21645f8d7682ee00414930ffa9ce0ca6","seed":{"bytes":231684,"sha256":"893f85f14a1870aa4d7f3b76be1d88253f1bc6cced238843bbe5f19026b4343e","url":"https://kody-w.github.io/hive-hub/api/hive-hub/v1/source/organization-seeds/product-launch-company.json"},"seed_status":"seed-not-activated","workspace_profile":"rapp-work-sdk/1"},"id":"dial:sha256:fef7e7dd08c7662b883a0c53615577f7f300a5aa0f1d8fa59ff14b1c0f4ddc90","join":{"kind":"subscription","next_step":"Inspect the The Product Launch Company seed's initialize.json, team work, and synthetic case. Use your locally trusted exact RAPP Work SDK to plan Organization and Workspace creation. Obtain approval of complete native plans and starter-file effects before setup. This subscription does not activate an organization, run downloaded code, or grant membership."},"learning":{"artifacts":[{"bytes":1698,"media_type":"application/json","role":"spec","sha256":"6f11e0a9a8165b35be877caf3651e0dbddc2b7cd7049407d3653ab6c036865a6","url":"https://kody-w.github.io/hive-hub/api/hive-hub/v1/source/protocols/rapp-work-organization-seed-v1.json"},{"bytes":1676,"media_type":"application/json","role":"conformance","sha256":"5e14ecb0fce1763e82254394724987b8fe8978e1c594553512d699b4a5d718a5","url":"https://kody-w.github.io/hive-hub/api/hive-hub/v1/source/conformance/rapp-work-organization-seed-v1.json"},{"bytes":231684,"media_type":"application/json","role":"examples","sha256":"893f85f14a1870aa4d7f3b76be1d88253f1bc6cced238843bbe5f19026b4343e","url":"https://kody-w.github.io/hive-hub/api/hive-hub/v1/source/organization-seeds/product-launch-company.json"}],"schema":"hive-hub-learning-bundle/1","sha256":"aabae06c90cc7490ed1542bf6ebdf78a58ea891c7fd37325cedbf4a255667115"},"name":"The Product Launch Company","protocol":{"fingerprint":"6f11e0a9a8165b35be877caf3651e0dbddc2b7cd7049407d3653ab6c036865a6","id":"rapp-work-sdk/1","spec_sha256":"6f11e0a9a8165b35be877caf3651e0dbddc2b7cd7049407d3653ab6c036865a6"},"schema":"hive-hub-declaration/1"}
